{
  "schema_version": "1.0", "dataset_version": "phase1c-v1", "scenario_id": "http-500", "target_service": "order",
  "cause": "Order version 2.0.0 introduced deterministic internal failures before dependency calls.",
  "symptoms": ["Order POST /v1/orders returns 500", "Gateway checkout observes downstream failure", "Order health and readiness remain successful"],
  "key_evidence": {"metrics": ["simulator.http.server.requests{service=order,status=500}"], "logs": ["Order http_request status=500"], "traces": ["POST /v1/orders server Span is ERROR with no dependency child"], "deployments": ["Order changed from 1.0.0 to 2.0.0 with an opaque deployment ID"]},
  "deployment_change": {"introduced_version": "2.0.0", "stable_predecessor": "1.0.0"},
  "automation_eligible": true, "eligibility_prerequisites": ["Evidence proves the regression began with version 2.0.0", "Server resolves 1.0.0 as the stable predecessor"],
  "expected_safe_outcome": "approved_rollback_or_handoff", "handoff_reason_code": "ROLLBACK_PREREQUISITES_MISSING", "recovery_action": "rollback_service",
  "verification": ["Error rate returns to baseline", "P95 latency is within threshold", "Health succeeds", "Active version is 1.0.0", "No new alerts during the stability window"],
  "evaluator_cleanup": {"action": "fault_clean", "readiness_check": "simulator_status", "recovery_credit": false}, "future_tool_requirement": null
}
